{
  "$id": "https://vanik.invalid/schemas/v1/DealResponse.schema.json",
  "$schema": "https://json-schema.org/draft/2020-12/schema",
  "additionalProperties": false,
  "properties": {
    "amount": {
      "title": "Amount",
      "type": "string"
    },
    "buyer_principal_id": {
      "format": "uuid",
      "title": "Buyer Principal Id",
      "type": "string"
    },
    "currency": {
      "const": "INR",
      "default": "INR",
      "title": "Currency",
      "type": "string"
    },
    "expires_at": {
      "format": "date-time",
      "title": "Expires At",
      "type": "string"
    },
    "id": {
      "format": "uuid",
      "title": "Id",
      "type": "string"
    },
    "label": {
      "const": "SIMULATED / NO REAL PAYMENT",
      "default": "SIMULATED / NO REAL PAYMENT",
      "title": "Label",
      "type": "string"
    },
    "seller_principal_id": {
      "format": "uuid",
      "title": "Seller Principal Id",
      "type": "string"
    },
    "snapshot": {
      "additionalProperties": true,
      "title": "Snapshot",
      "type": "object"
    },
    "status": {
      "title": "Status",
      "type": "string"
    },
    "task_id": {
      "format": "uuid",
      "title": "Task Id",
      "type": "string"
    },
    "terms_hash": {
      "title": "Terms Hash",
      "type": "string"
    },
    "version": {
      "title": "Version",
      "type": "integer"
    }
  },
  "required": [
    "id",
    "task_id",
    "version",
    "status",
    "buyer_principal_id",
    "seller_principal_id",
    "amount",
    "snapshot",
    "terms_hash",
    "expires_at"
  ],
  "title": "DealResponse",
  "type": "object"
}
