{
  "amount": "600.00",
  "buyer_principal_id": "00000001-0000-4000-8000-000000000001",
  "currency": "INR",
  "expires_at": "2027-11-02T10:00:00Z",
  "id": "00000028-0000-4000-8000-000000000001",
  "label": "SIMULATED / NO REAL PAYMENT",
  "seller_principal_id": "00000002-0000-4000-8000-000000000001",
  "snapshot": {
    "line_items": [
      {
        "claimed_discount_pct": "3.23",
        "claimed_original_price": "620.00",
        "line_total": "600.00",
        "product_id": "00000015-0000-4000-8000-000000000001",
        "quantity": "1.000",
        "sku": "STP-RICE-BAS-5K",
        "unit": "bag",
        "unit_price": "600.00"
      }
    ],
    "payment_destination": "mock-upi://synthetic"
  },
  "status": "locked",
  "task_id": "00000014-0000-4000-8000-000000000001",
  "terms_hash": "bbbbbbbbbbbbbbbbbbbbbbbbbbbbbbbbbbbbbbbbbbbbbbbbbbbbbbbbbbbbbbbb",
  "version": 1
}
